timestamp,time,f_scale,location,county,state,latitude,longitude,comments,report_point
2019-05-29 20:00:00.000000 UTC,2000,UNK,2 NW FATE,ROCKWALL,TX,32.97,-96.4,BRIEF TORNADO TOUCHDOWN. LOCATION APPROXIMATED. (FWD),POINT(-96.4 32.97)
2019-05-29 20:07:00.000000 UTC,2007,UNK,4 SSW CANTON,VAN ZANDT,TX,32.49,-95.89,A TORNADO DEVELOPED NEAR VAN ZANDT CR 2213... THEN TRACKED NORTHEAST ACROSS HWY 19 SOUTH OF CANTON. SHINGLE DAMAGE OCCURRED TO A HOME... AS WELL AS TREE BRANCHES WERE B (FWD),POINT(-95.89 32.49)
2019-05-29 20:21:00.000000 UTC,2021,UNK,CANTON,VAN ZANDT,TX,32.55,-95.87,TORNADO ON THE GROUND AT FM17 AND I-20 NEAR CANTON (FWD),POINT(-95.87 32.55)
2019-05-29 20:36:00.000000 UTC,2036,UNK,5 SW YANTIS,WOOD,TX,32.88,-95.63,A NWS STORM SURVEY AND EYEWITNESSES CONFIRMED THAT AN EF0 TORNADO FIRST TOUCHED DOWN NEAR THE INTERSECTION OF FM 515 AND FM 17 WHERE TIN WAS LIFTED AND PEELED BACK FROM (SHV),POINT(-95.63 32.88)
2019-05-29 21:24:00.000000 UTC,2124,UNK,3 W MABANK,KAUFMAN,TX,32.37,-96.15,A TORNADO BEGAN IN SOUTHERN KAUFMAN COUNTY ON THE NORTHWEST SIDE OF CEDAR CREEK RESERVOIR... NEAR FM 4042 AND VALENTINE RD. NOTABLE TREE DAMAGE WAS OBSERVED AT THE STAR (FWD),POINT(-96.15 32.37)
2019-05-29 21:28:00.000000 UTC,2128,UNK,2 SE KEMP,KAUFMAN,TX,32.43,-96.21,TORNADO 2 MILES SOUTHEAST OF KEMP MOVING ACROSS CEDAR CREEK LAKE (FWD),POINT(-96.21 32.43)
2019-05-29 21:50:00.000000 UTC,2150,UNK,3 SE WINNSBORO,WOOD,TX,32.92,-95.25,THIS TORNADO BEGAN ABOUT 3 MILES SE OF WINNSBORO... TX... SNAPPING AND UPROOTING TREES ALONG ITS PATH. THE MOST SIGNIFICANT DAMAGE OCCURRED NEAR THE INTERSECTION OF HWY (SHV),POINT(-95.25 32.92)
2019-05-29 21:51:00.000000 UTC,2151,UNK,9 WSW CANTON,VAN ZANDT,TX,32.48,-96.0,A TORNADO DEVELOPED NEAR THE COMMUNITY OF WHITTON... THEN MOVED NORTHEAST... DAMAGING SEVERAL HOMES IN ITS PATH. THE MOST EXTENSIVE DAMAGE WAS FOUND ON VAN ZANDT CR 250 (FWD),POINT(-96 32.48)
2019-05-29 21:58:00.000000 UTC,2158,UNK,4 WSW CANTON,VAN ZANDT,TX,32.53,-95.93,MULTI-VORTEX TORNADO WITH DEBRIS NEAR HIGHWAY 47 (FWD),POINT(-95.93 32.53)
2019-05-29 22:08:00.000000 UTC,2208,UNK,1 W CANTON,VAN ZANDT,TX,32.55,-95.88,A TORNADO DEVELOPED NEAR CANTON HIGH SCHOOL THEN MOVED TO THE NORTHEAST TOWARD DOWNTOWN CANTON. ABUNDANT TREE DAMAGE OCCURRED IN SOUTHWEST CANTON... THEN THE TORNADO ST (FWD),POINT(-95.88 32.55)
2019-05-29 22:15:00.000000 UTC,2215,UNK,CANTON,VAN ZANDT,TX,32.55,-95.87,TORNADO CROSSED I-20 NEAR FM 17 (FWD),POINT(-95.87 32.55)
2019-05-29 22:31:00.000000 UTC,2231,UNK,4 ESE BAILEY,FANNIN,TX,33.42,-96.1,DAMAGE CONSISTENT WITH AT LEAST ONE EF-0 TORNADO WAS FOUND IN A SWATH OF STRAIGHT LINE WIND DAMAGE. THE TORNADO FORMED APPROXIMATELY 3 MILES SOUTHEAST OF TRENTON... AND (FWD),POINT(-96.1 33.42)
2019-06-01 00:25:00.000000 UTC,0025,UNK,8 E MARATHON,Brewster,TX,30.21,-103.11,BRIEF LANDSPOUT DUST WHIRL DISCONNECTED FROM STORM OVER OPEN LAND. (MAF),POINT(-103.11 30.21)
2019-06-09 22:28:00.000000 UTC,2228,UNK,2 NNW COPPERAS COVE,CORYELL,TX,31.16,-97.93,TRAINED SPOTTER REPORTED A BRIEF TORNADO JUST NORTHWEST OF COPPERAS COVE. (FWD),POINT(-97.93 31.16)
2019-06-09 23:34:00.000000 UTC,2334,UNK,7 WSW LIBERTY HILL,WILLIAMSON,TX,30.63,-98.03,BASED ON EYEWITNESS REPORTS AND TREE DAMAGE PICTURES SENT INTO THE OFFICE. (EWX),POINT(-98.03 30.63)
2019-06-15 22:20:00.000000 UTC,2220,UNK,3 S SUMMERFIELD,CASTRO,TX,34.7,-102.51,NSSL-TORUS REPORT OF BRIEF TORNADO 3-4 MILES SOUTH OF SUMMERFIELD. ALSO RECEIVED A PUBLIC REPORT RELAYED BY MEDIA OF A FUNNEL AT THE SAME TIME AND LOCATION. (LUB),POINT(-102.51 34.7)
2019-06-16 20:07:00.000000 UTC,2007,UNK,FORT WORTH,TARRANT,TX,32.75,-97.34,A BRIEF EF-0 TORNADO WITH MAXIMUM WINDS OF 85 MPH TRACKED FOR ABOUT 1.25 MILES FROM THE CRAWFORD FARMS TO VISTA MEADOWS SUBDIVISION. (FWD),POINT(-97.34 32.75)
2019-06-16 20:25:00.000000 UTC,2025,UNK,1.5 NNE ARLINGTON,TARRANT,TX,32.75,-97.11,A BRIEF EF-1 TOR DEVELOPED JUST W/NW OF THE AT&T STADIUM & GLOBE LIFE PARK. SEVERAL TREES WERE SNAPPED & LOSS OF ROOFING (FWD),POINT(-97.11 32.75)
2019-06-19 01:10:00.000000 UTC,0110,UNK,2 NNE KINGSMILL,GRAY,TX,35.52,-101.05,BRIEF LAND SPOUT TORNADO WEST OF PAMPA NEAR HIGHWAY 152 REPORTED BY SEVERAL TRAINED SPOTTERS. TORNADO ON THE GROUND FOR TWO MINUTES. (AMA),POINT(-101.05 35.52)
2019-06-19 11:03:00.000000 UTC,1103,UNK,8 WNW NESBITT,HARRISON,TX,32.63,-94.58,NWS STORM SURVEY CONFIRMED AND EF-0 TORNADO. TORNADO TOUCHED DOWN BRIEFLY ALONG HIGHWAY 450 WHERE IT UPROOTED TREES AND SNAPPED BRANCHES. (SHV),POINT(-94.58 32.63)
2019-06-20 01:00:00.000000 UTC,0100,UNK,CARBON,EASTLAND,TX,32.27,-98.83,DELAYED REPORT: A VIDEO SHOWED A BRIEF TORNADO (LANDSPOUT) IN CARBON (EASTLAND COUNTY). NO DAMAGE WAS REPORTED. TIME ESTIMATED BY THE VIDEO AND SPOTTER REPORT. (FWD),POINT(-98.83 32.27)
2019-06-21 23:10:00.000000 UTC,2310,UNK,16 SE FORT STOCKTON,Pecos,TX,30.71,-102.68,(MAF),POINT(-102.68 30.71)
2019-06-23 03:43:00.000000 UTC,0343,UNK,4 SE GOODNIGHT,ARMSTRONG,TX,34.99,-101.14,BASED ON A NATIONAL WEATHER SERVICE DAMAGE SURVEY... THIS TORNADO TOUCHED DOWN AROUND 1043 PM 4 MILES SOUTHEAST OF GOODNIGHT AND LIFTED AT APPROXIMATELY 1049 PM CDT 4 M (AMA),POINT(-101.14 34.99)
2019-06-23 03:55:00.000000 UTC,0355,UNK,5 E GOODNIGHT,ARMSTRONG,TX,35.03,-101.1,BASED ON A NATIONAL WEATHER SERVICE DAMAGE SURVEY... THIS TORNADO TOUCHED DOWN AROUND 1055 PM 5 MILES EAST OF GOODNIGHT AND LIFTED AT APPROXIMATELY 1104 PM CDT 4 MILES (AMA),POINT(-101.1 35.03)
2019-06-24 23:02:00.000000 UTC,2302,UNK,10 WNW LIVE OAK,CONCHO,TX,31.18,-100.1,SPOTTER REPORTS CONE TORNADO. (SJT),POINT(-100.1 31.18)
2019-06-24 23:55:00.000000 UTC,2355,UNK,12 N FORT MCKAVETT,MENARD,TX,30.99,-100.09,COUNTY OFFICIALS RECEIVED A CALL OF A ROOF BEING LIFTED OFF A HOUSE. STORM CHASER REPORTED SEEING A TORNADO. (SJT),POINT(-100.09 30.99)
2019-07-14 19:45:00.000000 UTC,1945,UNK,2 W HINKLES FERRY,BRAZORIA,TX,28.95,-95.58,TORNADO REPORTED AT CR 310 FM 2611. (HGX),POINT(-95.58 28.95)
2019-07-26 20:15:00.000000 UTC,2015,UNK,3 N SOUTH PADRE ISLAND,CAMERON,TX,26.15,-97.17,BEACH PATROL AND EMERGENCY MANAGEMENT REPORTED THAT A WATERSPOUT MOVED ASHORE OFF OF THE GULF OF MEXICO AT BEACH ACCESS 3 ON SOUTH PADRE ISLAND. IT DISPLACED BEACH UMBR (BRO),POINT(-97.17 26.15)
2019-09-18 22:05:00.000000 UTC,2205,UNK,4 ENE HIGHLANDS,HARRIS,TX,29.84,-95.0,TORNADO DAMAGE TO BARN NEAR BARBERS HILL RD AND HANEY RD. (HGX),POINT(-95 29.84)
2019-09-18 22:10:00.000000 UTC,2210,UNK,3 W MONT BELVIEU,CHAMBERS,TX,29.85,-94.94,TORNADO ON GROUND PHOTOGRAPHED NEAR N MAIN AND FM1942... WEST OF MONT BELVIEU. (HGX),POINT(-94.94 29.85)
2019-09-18 23:30:00.000000 UTC,2330,UNK,4 NNE ANAHUAC,CHAMBERS,TX,29.81,-94.66,SPOTTER REPORTED TORNADO ON GROUND 4 MILES NNE OF ANAHUAC. (HGX),POINT(-94.66 29.81)
2019-09-24 22:30:00.000000 UTC,2230,UNK,12 N SIERRA BLANCA,HUDSPETH,TX,31.35,-105.36,TWO LANDSPOUT TORNADOES WERE OBSERVED NORTH OF SIERRA BLANCA. BOTH LANDSPOUTS LASTED AN UNKNOWN AMOUNT OF TIME. NO INJURIES OR DAMAGE WERE ASSOCIATED WITH EITHER LANDSP (EPZ),POINT(-105.36 31.35)
2019-10-21 00:36:00.000000 UTC,0036,UNK,8 SW BECKVILLE,PANOLA,TX,32.16,-94.55,AN EF-0 TORNADO TOUCHED DOWN ALONG THE SOUTH SIDE OF HIGHWAY 79 JUST WEST OF CR 280 IN WESTERN PANOLA COUNTY AND HEADED EAST-NORTHEAST. IT DID MAINLY TREE DAMAGE WITH S (SHV),POINT(-94.55 32.16)
2019-10-21 00:43:00.000000 UTC,0043,UNK,7 SSW BECKVILLE,PANOLA,TX,32.15,-94.5,TREES DOWN ALONG HWY 79 WITH MULTIPLE POWER FLASHES REPORTED ONGOING. (SHV),POINT(-94.5 32.15)
2019-10-21 00:48:00.000000 UTC,0048,UNK,8 SSW BECKVILLE,PANOLA,TX,32.15,-94.53,TREES DOWN. (SHV),POINT(-94.53 32.15)
2019-10-21 02:10:00.000000 UTC,0210,UNK,MIDLOTHIAN,ELLIS,TX,32.5,-96.99,AN NWS STORM SURVEY TEAM CONFIRMED AN EF-1 TORNADO IN MIDLOTHIAN WITH ESTIMATED PEAK WINDS OF 100 MPH. THE PATH WAS 2.9 MILES LONG... WITH A MAXIMUM WIDTH OF 380 YARDS. (FWD),POINT(-96.99 32.5)
2019-10-21 02:42:00.000000 UTC,0242,UNK,FERRIS,ELLIS,TX,32.53,-96.67,AN NWS STORM SURVEY TEAM CONFIRMED AN EF-0 TORNADO IN FERRIS WITH ESTIMATED PEAK WINDS OF 85 MPH. THE PATH LENGTH WAS 0.18 MILES... WITH A MAXIMUM WIDTH OF 160 YARDS. (FWD),POINT(-96.67 32.53)
2019-10-21 02:48:00.000000 UTC,0248,UNK,ROCKWALL,ROCKWALL,TX,32.93,-96.45,UPDATE: BASED ON VIDEO FOOTAGE... THE ROCKWALL DAMAGE IS CONSISTENT WITH EF-1 TORNADO DAMAGE AND MAX WINDS OF 90 MPH (FWD),POINT(-96.45 32.93)
2019-10-21 03:10:00.000000 UTC,0310,UNK,5 N KAUFMAN,KAUFMAN,TX,32.65,-96.32,AN NWS STORM SURVEY TEAM CONFIRMED AN EF-0 TORNADO NEAR KAUFMAN WITH ESTIMATED PEAK WINDS OF 80 MPH. THE PATH LENGTH WAS 70 YARDS (0.04 MILES)... WITH A PATH WIDTH OF 5 (FWD),POINT(-96.32 32.65)
2019-10-21 03:39:00.000000 UTC,0339,UNK,3.5 SE ELMO,KAUFMAN,TX,32.67,-96.14,AN NWS STORM SURVEY TEAM CONFIRMED AN EF-1 TORNADO NEAR ELMO WITH ESTIMATED PEAK WINDS OF 105 MPH. THE PATH LENGTH WAS 0.5 MILE... WITH A MAXIMUM PATH WIDTH OF 250 YARD (FWD),POINT(-96.14 32.67)
2019-10-21 03:59:00.000000 UTC,0359,UNK,2 N WILLS POINT,VAN ZANDT,TX,32.73,-96.0,NWS DAMAGE SURVEY TEAM FOUND DAMAGE CONSISTENT WITH AN EF-0 RATING WITH MAXIMUM WINDS OF 78 MPH NEAR WILLS POINT. THE PATH BEGAN ABOUT 2 MILES NORTH OF WILLS POINT... (FWD),POINT(-96 32.73)
2019-10-21 08:08:00.000000 UTC,0808,UNK,5 SSE MARIETTA,CASS,TX,33.1,-94.5,TORNADO TRACKED THROUGH RURAL PORTIONS OF CENTRAL CASS COUNTY... PRIMARILY DOING TREE DAMAGE. THE TORNADO TOUCHED DOWN AT COUNTY ROAD 1450 AND LIFTED JUST AFTER CROSSIN (SHV),POINT(-94.5 33.1)
2019-04-19 15:22:00.000000 UTC,1522,UNK,3 NNE THAXTON,BEDFORD,VA,37.39,-79.61,CORRECTS PREVIOUS TSTM WND DMG REPORT FROM 3 NNE THAXTON... TO A TORNADO... AND ALSO INCLUDES CORRECTING THE TIME. A NWS DAMAGE SURVEY CONCLUDED A TORNADO TOUCHED DOWN (RNK),POINT(-79.61 37.39)
2019-04-19 21:31:00.000000 UTC,2131,UNK,3 ESE SHIPMAN,NELSON,VA,37.7,-78.79,AN EF1 TORNADO DOWNED 100 TO 200 TREES. ONE TREE FELL AND KILLED A HORSE. ONE TREE FELL ON THREE VEHICLES. SEVERAL OUTBUILDINGS AND SHEDS DAMAGED OR DESTROYED. MAX WIND (LWX),POINT(-78.79 37.7)
2019-04-19 22:48:00.000000 UTC,2248,UNK,1 SSE DAHLIA,GREENSVILLE,VA,36.55,-77.53,(AKQ),POINT(-77.53 36.55)
2019-04-19 22:50:00.000000 UTC,2250,UNK,1 NW CLARESVILLE,GREENSVILLE,VA,36.63,-77.46,(AKQ),POINT(-77.46 36.63)
2019-04-19 22:50:00.000000 UTC,2250,UNK,3 ESE FORKSVILLE,BRUNSWICK,VA,36.74,-77.99,REPORTED AT 950 AND 1450 EVANS CREEK RD... BRODNAX... VA. SMALL STRUCTURES DAMAGED. TREE ON A HOUSE AND TOPS OF TREES TWISTED OFF. (AKQ),POINT(-77.99 36.74)
2019-04-19 22:55:00.000000 UTC,2255,UNK,3 SSW EMPORIA RESERVOIR,GREENSVILLE,VA,36.66,-77.58,(AKQ),POINT(-77.58 36.66)
2019-04-19 22:55:00.000000 UTC,2255,UNK,1 ENE EMPORIA RESERVOIR,CITY OF EMPORIA,VA,36.71,-77.55,(AKQ),POINT(-77.55 36.71)
2019-04-19 23:25:00.000000 UTC,2325,UNK,3 NNE BOOKER,SUSSEX,VA,36.98,-77.27,(AKQ),POINT(-77.27 36.98)
2019-04-19 23:33:00.000000 UTC,2333,UNK,4 SE DISPUTANTA,SUSSEX,VA,37.09,-77.17,(AKQ),POINT(-77.17 37.09)
2019-04-19 23:37:00.000000 UTC,2337,UNK,3 NNW BARHAM,PRINCE GEORGE,VA,37.18,-77.13,(AKQ),POINT(-77.13 37.18)
2019-04-19 23:48:00.000000 UTC,2348,UNK,1 E RUTHVILLE,CHARLES CITY,VA,37.37,-77.03,NWS STORM SURVEY CONFIRMED AN EF2 TORNADO IN CHARLES CITY COUNTY... VA NEAR RUTHVILLE. (AKQ),POINT(-77.03 37.37)
2019-04-19 23:56:00.000000 UTC,2356,UNK,2 WNW LAWSON,ISLE OF WIGHT,VA,37.03,-76.66,(AKQ),POINT(-76.66 37.03)
2019-04-19 23:57:00.000000 UTC,2357,UNK,4 NNW BARHAM,PRINCE GEORGE,VA,37.19,-77.15,TORNADO SPOTTED BY THE PUBLIC WITH SEVERAL TREES DOWN. REPORTED AT 9014 HINES RD... DISPUTANA. TIME ESTIMATED FROM RADAR. (AKQ),POINT(-77.15 37.19)
2019-04-20 00:06:00.000000 UTC,0006,UNK,QUEENS LAKE,YORK,VA,37.29,-76.66,NWS STORM SURVEY CONFIRMED AN EF0 TORNADO IN THE QUEENS LAKE SECTION OF YORK COUNTY... VA. (AKQ),POINT(-76.66 37.29)
2019-04-20 00:07:00.000000 UTC,0007,UNK,2 N FREDERICKS HALL,LOUISA,VA,38.01,-77.82,(AKQ),POINT(-77.82 38.01)
2019-04-20 00:12:00.000000 UTC,0012,UNK,1 NW FREDERICKS HALL,LOUISA,VA,38.0,-77.84,TRAIN SPOTTER CONFIRMS A TORNADO ON THE GROUND WITH POWER FLASHES AT THE 6200 BLOCK OF FREDERICK HALL IN LOUISA COUNTY. (AKQ),POINT(-77.84 38)
2019-04-20 00:20:00.000000 UTC,0020,UNK,1 SSW MARYUS,GLOUCESTER,VA,37.27,-76.41,NWS STORM SURVEY CONFIRMED AN EF0 TORNADO NEAR MARYUS IN GLOUCESTER COUNTY... VA. (AKQ),POINT(-76.41 37.27)
2019-04-20 00:59:00.000000 UTC,0059,UNK,1 NNW RESTON,FAIRFAX,VA,38.97,-77.36,TREE DAMAGE NEAR INTERSECTION OF QUIETREE DRIVE AND CROSSWIND DRIVE. ONE HOUSE CONDEMNED WITH TREE FALLING THROUGH ROOF. DETERMINATION OF TORNADO INTENSITY WILL BE MADE (LWX),POINT(-77.36 38.97)
2019-05-11 22:52:00.000000 UTC,2252,UNK,2 NE DOWNTOWN SUFFOLK,CITY OF SUFFOLK,VA,36.74,-76.57,DAMAGE TO 14 HOMES AND 6 BUSINESSES REPORTED FROM 1045 BLOCK OF MACARTHUR DRIVE IN SUFFOLK. (AKQ),POINT(-76.57 36.74)
2019-10-31 23:04:00.000000 UTC,2304,UNK,2 W NEW MARKET,ROCKINGHAM,VA,38.64,-78.71,EF-0 TORNADO CONFIRMED. PATH LENGTH 0.5 MILES. WIDTH 25 YARDS. MAX WINDS 75 MPH. (LWX),POINT(-78.71 38.64)
2019-10-31 23:48:00.000000 UTC,2348,UNK,4 SW BUFFALO SPRINGS,MECKLENBURG,VA,36.61,-78.71,CONFIRMED TORNADO TOUCHED DOWN NEAR WHITE HOUSE RD IN FAR SOUTHWEST MECKLENBURG COUNTY. TORNADO TRAVELED NORTHEAST FOR APPROX. 10 MINUTES BEFORE LIFTING SHORTLY AFTER C (AKQ),POINT(-78.71 36.61)
2019-11-01 04:55:00.000000 UTC,0455,UNK,2 S CHESAPEAKE AIRPORT,CITY OF CHESAPEAK,VA,36.63,-76.33,NWS STORM SURVEY CONFIRMED AN EF1 TORNADO IN THE CITY OF CHESAPEAKE. THE TORNADO TOUCHED DOWN NEAR BENEFIT RD. AND RAPIDLY TRACKED ENE 4.9 MILES BEFORE LIFTING PRIOR TO (AKQ),POINT(-76.33 36.63)
2019-08-21 21:05:00.000000 UTC,2105,UNK,1 N WINDHAM,WINDHAM,VT,43.19,-72.73,EF1 TORNADO CONFIRMED. ESTIMATED MAXIMUM WIND SPEED 105 TO 110 MPH. (ALY),POINT(-72.73 43.19)
2019-10-04 20:57:00.000000 UTC,2057,UNK,1 WSW TENINO,THURSTON,WA,46.85,-122.88,AT APPROXIMATELY 157 PM ON OCTOBER 4TH A BRIEF... WEAK TORNADO TOUCHED DOWN NEAR TENINO WA IN THURSTON COUNTY. THE TORNADO PRODUCED NO KNOWN SIGNIFICANT DAMAGE. THE LOC (SEW),POINT(-122.88 46.85)
2019-10-19 01:07:00.000000 UTC,0107,UNK,9 ENE SHELTON,MASON,WA,47.26,-122.93,AN NWS STORM SURVEY FOUND AN EF-1 TORANDO TOUCHED DOWN NEAR SHELTON BETWEEN 6:02 AND 6:07 PM ON 10/18. ESTIMATED PEAK WINDS WERE 90-100 MPH. PATH LENGTH WAS 0.68 MILES. (SEW),POINT(-122.93 47.26)
2019-06-14 23:54:00.000000 UTC,2354,UNK,4 WNW KENNAN,PRICE,WI,45.55,-90.67,START POINT OF KENNAN/OGEMA TORNADO. TIME ESTIMATED FROM RADAR. (DLH),POINT(-90.67 45.55)
2019-06-15 00:02:00.000000 UTC,0002,UNK,1 NW KENNAN,PRICE,WI,45.54,-90.6,SEVERAL HARDWOOD TREE BRANCHES BROKEN. TIME ESTIMATED FROM RADAR. (DLH),POINT(-90.6 45.54)
2019-06-15 00:09:00.000000 UTC,0009,UNK,1 WSW CATAWBA,PRICE,WI,45.53,-90.55,CHICKEN COOP FLIPPED OVER AND TIN ROOF BLOWN OFF SHED. TIME ESTIMATED FROM RADAR. THIS REPORT CORRECTS PREVIOUS THUNDERSTORM WIND DAMAGE REPORT FROM 1 WSW CATAWBA. (DLH),POINT(-90.55 45.53)
2019-06-15 00:34:00.000000 UTC,0034,UNK,3 WNW OGEMA,PRICE,WI,45.46,-90.35,SOFTWOOD TREE AND SEVERAL BRANCHES BROKEN. TIME ESTIMATED FROM RADAR. (DLH),POINT(-90.35 45.46)
2019-07-04 22:39:00.000000 UTC,2239,UNK,8 SSE WEYERHAEUSER,RUSK,WI,45.32,-91.35,A NWS STORM SURVEY INDICATED THAT AN EF0 TORNADO TOUCHED DOWN ON THE WEST SIDE OF FIRESIDE LAKE... ON MUD LAKE ROAD. THE TORNADO TRACKED APPROXIMATELY 7.7 MILES NORTHEA (MPX),POINT(-91.35 45.32)
2019-07-04 22:50:00.000000 UTC,2250,UNK,8 S BRUCE,RUSK,WI,45.34,-91.27,DELAYED REPORT... TIME ESTIMATED VIA RADAR. TREES & POWER LINES DOWN OVER LAKE PULASKI ROAD. (MPX),POINT(-91.27 45.34)
2019-07-16 00:15:00.000000 UTC,0015,UNK,1 E BRUCE,RUSK,WI,45.46,-91.25,LAW ENFORCEMENT AND TRAINED SPOTTER CONFIRMED TORNADO ON GROUND EAST OF BRUCE. (MPX),POINT(-91.25 45.46)
2019-07-16 22:35:00.000000 UTC,2235,UNK,3 S PLAINFIELD,WAUSHARA,WI,44.17,-89.48,WEAK... BRIEF... THIN TORNADO LOFTED DUST AND A FEW SMALL TREE BRANCHES IN AN OPEN FIELD BETWEEN HANCOCK AND PLAINFIELD. TORNADO/FUNNEL SEEN BY SPOTTER... LAW ENFORCEME (GRB),POINT(-89.48 44.17)
2019-07-19 04:42:00.000000 UTC,0442,UNK,5 NE WESTBY,VERNON,WI,43.7,-90.79,BRIEF TORNADO DAMAGED FARM BUILDINGS ALONG WANG RIDGE ROAD... IN ADDITION TO TREES. MAY HAVE LASTED FOR 1-2 MIN. EST. EF0 (ARX),POINT(-90.79 43.7)
2019-07-19 22:36:00.000000 UTC,2236,UNK,3 NW TURTLE LAKE,POLK,WI,45.43,-92.18,AN EF1 TORNADO CAUSED EXTENSIVE TREE DAMAGE IN A CONCENTRATED PATH BEGINNING ABOUT 3.3 MILES NORTHWEST OF TURTLE LAKE. ESTIMATED MAX WINDS 90 MPH... PATH LENGTH 3 MILES (MPX),POINT(-92.18 45.43)
2019-07-19 22:44:00.000000 UTC,2244,UNK,2 W ALMENA,BARRON,WI,45.41,-92.09,A BRIEF EF0 TORNADO CAUSED TREE DAMAGE AND SOME MINOR STRUCTURAL DAMAGE TO OUTBUILDINGS. PATH LENGTH WAS 0.8 MILES... MAX PATH WIDTH WAS 50 YARDS... AND MAXIMUM WIND SP (MPX),POINT(-92.09 45.41)
2019-07-20 00:17:00.000000 UTC,0017,UNK,4 W WITHEE,CLARK,WI,44.96,-90.68,CORRECTS PREVIOUS TORNADO REPORT FROM 4 W WITHEE. TORNADO CROSSED COUNTY RD O AND NEARBY TRAIN TRACKS BEFORE DISSIPATING. DAMAGE NOTED TO ONE FARMSTEAD AS WELL AS NEARB (ARX),POINT(-90.68 44.96)
2019-07-20 00:24:00.000000 UTC,0024,UNK,2 NNW WITHEE,CLARK,WI,44.98,-90.62,CORRECTS PREVIOUS REPORT FOR INCORRECT DATE. TORNADO CROSSED CENTER ROAD TRAVELING NORTHEAST BEFORE DISSIPATING PRIOR TO REACHING THE RAILROAD TRACKS AND NERDRUM DRIVE. (ARX),POINT(-90.62 44.98)
2019-07-20 00:45:00.000000 UTC,0045,UNK,4 E JEFFRIS,ONEIDA,WI,45.5,-89.35,TORNADO ON THE GROUND JUST WEST OF PELICAN LAKE. PRELIMINARY RATING-EF1. (GRB),POINT(-89.35 45.5)
2019-07-20 01:25:00.000000 UTC,0125,UNK,5 S MOSINEE,MARATHON,WI,44.71,-89.69,TORNADO ON THE GROUND FOR AT LEAST 9 MILES SOUTH OF MOSINEE. DAMAGE TO HUNDREDS OF TREES. BARN DEMOLISHED... DAMAGE TO THE ROOFS OF SEVERAL BUILDINGS. TORNADO CROSSED I (GRB),POINT(-89.69 44.71)
2019-07-20 14:10:00.000000 UTC,1410,UNK,3 W NORTH BEND,TREMPEALEAU,WI,44.1,-91.17,TORNADO BEGAN IN A CORN FIELD JUST WEST OF WALLER LANE... WITH DAMAGE EXTENDING ACROSS HIGHWAY 54. TORNADO DISSIPATED NEAR A WOODED AREA JUST EAST OF STURH ROAD. DAMAGE (ARX),POINT(-91.17 44.1)
2019-07-20 15:55:00.000000 UTC,1555,UNK,1 E WAUPACA,WAUPACA,WI,44.34,-89.04,TORNADO FORMED NEAR WAUPACA AIRPORT AND MOVED EAST-NORTHEAST TO WHITE LAKE. DAMAGE TO SEVERAL BUILDINGS... CORN FIELD... AND TREES. RATED EF0. (GRB),POINT(-89.04 44.34)
2019-07-20 16:00:00.000000 UTC,1600,UNK,1 S WEYAUWEGA,WAUPACA,WI,44.3,-88.93,WEAK TORNADO DAMAGED A FEW TREES SOUTH AND SOUTHEAST OF WEYAUWEGA. (GRB),POINT(-88.93 44.3)
2019-07-20 16:05:00.000000 UTC,1605,UNK,3 SSW NEW LONDON,WAUPACA,WI,44.35,-88.78,TORNADO ON THE GROUND SOUTH OF NEW LONDON. TORNADO CROSSED FROM WAUPACA INTO OUTAGAMIE COUNTY. TREES AND A FEW POWER POLES SNAPPED. PARTIAL DAMAGE TO SIDING AND ROOFS. (GRB),POINT(-88.78 44.35)
2019-07-20 16:18:00.000000 UTC,1618,UNK,2 S STEPHENSVILLE,OUTAGAMIE,WI,44.33,-88.58,TORNADO ON THE GROUND EAST OF HORTONVILLE. 3 TO 4 POWER POLES SNAPPED... CAR PORT DESTROYED... 2 OUTBUILDINGS PARTIALLY DAMAGED... SEVERAL TREES SNAPPED... PARTIAL LOSS (GRB),POINT(-88.58 44.33)
2019-07-20 16:36:00.000000 UTC,1636,UNK,3 ENE KAUKAUNA,OUTAGAMIE,WI,44.3,-88.21,TORNADO ON THE GROUND NEAR WRIGHTSTOWN. LOSS OF METAL ROOFING ON BARN AND LOSS OF THE TOP OF A SILO. PRELIMINARY RATING-EF0 (GRB),POINT(-88.21 44.3)
2019-07-28 22:31:00.000000 UTC,2231,UNK,5 E MILLTOWN,POLK,WI,45.52,-92.4,TORNADO SPUN UP 5 NE OF BALSAM LAKE... CROSSED BONE LAKE... THEN DISSIPATED 3 E OF LUCK... WI. TREE DAMAGE OCCURRED ALONG PATH WITH 90 MPH WINDS AND A MAX PATH WIDTH OF (MPX),POINT(-92.4 45.52)
2019-07-28 23:41:00.000000 UTC,2341,UNK,5 NNE DALLAS,BARRON,WI,45.33,-91.79,TORNADO SPUN UP 6 SSE BARRON AND TRACKED NORTHEAST 0.4 MILES. MAX WIND 74 MPH AND MAX WIDTH 25 YARDS. (MPX),POINT(-91.79 45.33)
2019-07-29 00:00:00.000000 UTC,0000,UNK,4 SSE BARRON,BARRON,WI,45.35,-91.83,LAW ENFORCEMENT RELAYED A REPORT OF A SHED DESTROYED. TORNADO SIGHTED BY PUBLIC. (MPX),POINT(-91.83 45.35)
2019-08-07 22:48:00.000000 UTC,2248,UNK,1 SSE GREEN BAY,BROWN,WI,44.49,-87.99,TORNADO TOUCHED DOWN ON SOUTHEAST SIDE OF CITY OF GREEN BAY AND MOVED SOUTHEAST INTO TOWN OF BELLEVUE. EF0 DAMAGE WITH PEAK WINDS ESTIMATED NEAR 85 MPH. SEVERAL BUILDIN (GRB),POINT(-87.99 44.49)
2019-09-25 00:48:00.000000 UTC,0048,UNK,1 ENE ELK MOUND,DUNN,WI,44.88,-91.67,*** 2 INJ *** A TORNADO SPUN UP JUST EAST OF ELK MOUND AND RAPIDLY BECAME AN EF3 AS IT DESTROYED SEVERAL STRUCTURES NEAR WI-29 AND CR M. PINE TREES WERE LEVELED... SOME (MPX),POINT(-91.67 44.88)
2019-09-25 02:26:00.000000 UTC,0226,UNK,4 SSW GREENWOOD,CLARK,WI,44.72,-90.63,TORNADO TRACKED FROM SOUTH SOUTHWEST OF GREENWOOD TO WEST OF LOYAL FOR APPROX 5 MIN DAMAGING TREES... BARNS... AND SILOS (ARX),POINT(-90.63 44.72)
2019-10-02 02:25:00.000000 UTC,0225,UNK,4 SE ROCKDALE,JEFFERSON,WI,42.93,-88.97,NWS STORM SURVEY CONFIRMS AN EF-0 RATED TORNADO WITH PEAK WINDS OF 80 MPH. STARTING POINT IS JUST WEST OF FORT ATKINSON NEAR HIGHWAY A BETWEEN ADVENT RD. AND KLEMENT RD (MKX),POINT(-88.97 42.93)
2019-10-02 02:42:00.000000 UTC,0242,UNK,3 WSW SULLIVAN,JEFFERSON,WI,42.99,-88.64,CORRECTS PREVIOUS TORNADO REPORT FROM 3 WSW SULLIVAN. NWS STORM SURVEY CONFIRMS AN EF-1 RATED TORNADO WITH PEAK WINDS OF 100 MPH. NUMEROUS TREES SNAPPED OR UPROOTED. RO (MKX),POINT(-88.64 42.99)
2019-06-24 22:53:00.000000 UTC,2253,UNK,CHARLESTON,KANAWHA,WV,38.35,-81.63,A TORNADO TOUCHED DOWN NEAR THE LINCOLN/KANAWHA COUNTY LINE. IT CONTINUED MOVING TO THE NORTHEAST THROUGH KANAWHA COUNTY AND EVENTUALLY DISSIPATED NEAR THE KANAWHA RIVE (RLX),POINT(-81.63 38.35)
2019-06-24 22:54:00.000000 UTC,2254,UNK,3 ENE ALUM CREEK,KANAWHA,WV,38.3,-81.75,POSSIBLE TORNADO. EXTENSIVE DAMAGE TO TREES AND SOME DAMAGE TO HOMES OFF CHILDRESS ROAD IN THE COVENTRY WOODS SUBDIVISION. (RLX),POINT(-81.75 38.3)
2019-06-24 23:00:00.000000 UTC,2300,UNK,KANAWHA CITY,KANAWHA,WV,38.32,-81.58,POSSIBLE TORNADO DEBRIS LANDED ON MACCORKLE AVE IN KANAWHA CITY. (RLX),POINT(-81.58 38.32)
2019-04-26 18:30:00.000000 UTC,1830,UNK,MARBLETON,SUBLETTE,WY,42.56,-110.1,EF-0 TORNADO... MAX WIND 80 MPH... WIDTH 20 YARDS... PATH LENGTH 0.10 MILES (RIW),POINT(-110.1 42.56)
2019-05-06 22:00:00.000000 UTC,2200,UNK,5 E NORTH CHEYENNE,LARAMIE,WY,41.23,-104.7,BRIEF TOUCHDOWN REPORTED BUT QUICKLY LIFTED SHORTLY AFTER. (CYS),POINT(-104.7 41.23)
2019-06-20 01:43:00.000000 UTC,0143,UNK,4 SE BILL,CONVERSE,WY,43.17,-105.2,A TORNADO WAS REPORTED ON THE GROUND AT 757 PM BY CONVERSE COUNTY DISPATCH ON HIGHWAY 59 AT MILE MARKER 30. (CYS),POINT(-105.2 43.17)
2019-06-20 01:50:00.000000 UTC,0150,UNK,BILL,CONVERSE,WY,43.21,-105.26,THE TRAVEL LODGE IN BILL REPORTED A TORNADO TOUCH DOWN IN THEIR BACK PARKING LOT AT ABOUT 750 PM. (CYS),POINT(-105.26 43.21)
2019-06-20 01:57:00.000000 UTC,0157,UNK,4 SE BILL,CONVERSE,WY,43.17,-105.2,CORRECTS PREVIOUS TORNADO REPORT FROM 4 SE BILL. A TORNADO WAS REPORTED ON THE GROUND AT 757 PM BY CONVERSE COUNTY DISPATCH ON HIGHWAY 59 AT MILE MARKER 30. (CYS),POINT(-105.2 43.17)
2019-06-20 02:03:00.000000 UTC,0203,UNK,13 ESE BILL,CONVERSE,WY,43.12,-105.04,IMAGE RECEIVED VIA FACEBOOK OF ROOF DAMAGE TO RESIDENCE. TIME BASED OFF OF RADAR. (CYS),POINT(-105.04 43.12)
2019-06-20 02:25:00.000000 UTC,0225,UNK,3 WNW LANCE CREEK,NIOBRARA,WY,43.04,-104.7,REPORT OF DAMAGE TO AREA BUSINESS. (CYS),POINT(-104.7 43.04)
2019-06-20 02:40:00.000000 UTC,0240,UNK,1 NNW LANCE CREEK,NIOBRARA,WY,43.03,-104.65,REPORT OF ROOF DAMAGE AT LANCE CREEK POST OFFICE. TIME ESTIMATED BASED OFF OF RADAR. (CYS),POINT(-104.65 43.03)
2019-06-26 02:03:00.000000 UTC,0203,UNK,5 N HULETT,CROOK,WY,44.75,-104.61,SEVERAL TREES UPROOTED CROSSED HWY 112 ABOUT 803 PM (UNR),POINT(-104.61 44.75)
2019-07-03 22:27:00.000000 UTC,2227,UNK,2 SW DEWEY,WESTON,WY,43.51,-104.06,MULTIPLE SPOTTERS REPORTED A TORNADO SOUTHWEST OF DEWEY BEGINNING AT 428 PM. TORNADO WAS UP AND DOWN THROUGH 444 PM. (UNR),POINT(-104.06 43.51)
2019-07-03 22:30:00.000000 UTC,2230,UNK,12 NE MULE CREEK JUNCTI,NIOBRARA,WY,43.5,-104.06,(CYS),POINT(-104.06 43.5)
2019-07-04 22:45:00.000000 UTC,2245,UNK,13 NNE IRON MOUNTAIN,PLATTE,WY,41.72,-105.1,FIRE CHIEF OF CHUGWATER OBSERVED TORNADO RAIN WRAPPED (CYS),POINT(-105.1 41.72)
2019-07-04 23:15:00.000000 UTC,2315,UNK,S CHUGWATER,PLATTE,WY,41.6,-104.7,TORNADO ON GROUND AT MILE MARKER 47 (CYS),POINT(-104.7 41.6)
2019-07-04 23:15:00.000000 UTC,2315,UNK,S CHUGWATER,PLATTE,WY,41.69,-104.84,TORNADO ON GROUND. SPOTTERS ARE LOCATED AT MILE MARKER 47 OF I-25. TORNADO IS NORTH OF SPOTTERS. THIS CORRECTS PREVIOUS REPORT. (CYS),POINT(-104.84 41.69)
2019-07-07 00:18:00.000000 UTC,0018,UNK,3 SSE BOSLER,ALBANY,WY,41.54,-105.67,RECEIVED VIDEO OF TORNADO VIA TWITTER. (CYS),POINT(-105.67 41.54)
2019-07-17 01:34:00.000000 UTC,0134,UNK,6 E ROZET,CAMPBELL,WY,44.27,-105.08,A MILE SOUTH OF I-90 ALONG THE CAMPBELL COUNTY AND CROOK COUNTY LINE. WAS THE GROUND FROM 734-744PM MDT (UNR),POINT(-105.08 44.27)
2019-07-18 00:05:00.000000 UTC,0005,UNK,22 NE LUSK,NIOBRARA,WY,42.99,-104.15,CONFIRMED TORNADO ON THE GROUND. BROKEN BRANCHES. FOUR TO FIVE HOMES WITHOUT POWER. PING PONG BALL SIZE HAIL AND HEAVY RAIN. (CYS),POINT(-104.15 42.99)
2019-07-18 00:52:00.000000 UTC,0052,UNK,1 WSW FOUR CORNERS,WESTON,WY,44.08,-104.16,(UNR),POINT(-104.16 44.08)
2019-08-11 20:54:00.000000 UTC,2054,UNK,3 S HILLSDALE,LARAMIE,WY,41.16,-104.48,IMAGES RECEIVED OF BRIEF LANDSPOUT TORNADO. (CYS),POINT(-104.48 41.16)
2019-08-23 22:22:00.000000 UTC,2222,UNK,BAR NUNN,NATRONA,WY,42.93,-106.35,WAS OBSERVED FOR 2 TO 3 MINUTES NEAR ANTELOPE HILLS. (RIW),POINT(-106.35 42.93)
2019-09-10 21:09:00.000000 UTC,2109,UNK,2 SE HARTVILLE,PLATTE,WY,42.31,-104.7,(CYS),POINT(-104.7 42.31)
2019-09-10 22:58:00.000000 UTC,2258,UNK,5 E CHUGWATER,PLATTE,WY,41.76,-104.72,ROPE TORNADO OBSERVED (CYS),POINT(-104.72 41.76)
2019-03-03 20:03:00.000000 UTC,2003,UNK,2 N MARVYN,LEE,AL,32.47,-85.37,CONFIRMED DAMAGE NEAR DUPREE... AL. MULTIPLE HOMES DAMAGED. TORNADO CONFIRMED BY RADAR. (BMX),POINT(-85.37 32.47)
2019-03-03 20:09:00.000000 UTC,2009,UNK,2 SSE GRIFFEN MILL,LEE,AL,32.5,-85.25,TREES AND POWER LINES DOWN NEAR THE INTERSECTION 401 AND 175 NEAR CRAWFORD...AL. (BMX),POINT(-85.25 32.5)
2019-03-03 20:22:00.000000 UTC,2022,UNK,SALEM,LEE,AL,32.6,-85.24,US HWY 280 BLOCKED BY DOWNED CELL TOWER ACROSS HWY. (BMX),POINT(-85.24 32.6)
